{
 "$schema": "https://json-schema.org/draft/2020-12/schema",
 "$id": "https://github.com/gotalab/s1flow/blob/main/schema/split-2.json",
 "additionalProperties": false,
 "properties": {
  "schema": {
   "const": "s1flow/split@2",
   "default": "s1flow/split@2",
   "title": "Schema",
   "type": "string"
  },
  "seed": {
   "title": "Seed",
   "type": "integer"
  },
  "test_share": {
   "title": "Test Share",
   "type": "number"
  },
  "at": {
   "title": "At",
   "type": "string"
  },
  "source": {
   "title": "Source",
   "type": "string"
  },
  "assign": {
   "additionalProperties": {
    "enum": [
     "train",
     "val",
     "test"
    ],
    "type": "string"
   },
   "title": "Assign",
   "type": "object"
  }
 },
 "required": [
  "seed",
  "test_share",
  "at",
  "source",
  "assign"
 ],
 "title": "SplitFile",
 "type": "object"
}
