{
 "schema": "s1flow/split@2",
 "seed": 1,
 "test_share": 0.3,
 "at": "2026-10-31T05:10:30Z",
 "source": "initial",
 "assign": {
  "#26136": "train",
  "#28820": "train",
  "#26262": "train",
  "#25941": "train",
  "#26150": "train",
  "#26595": "train",
  "#28424": "train",
  "#26450": "train",
  "#29340": "train",
  "#28532": "train",
  "#27159": "train",
  "#27631": "train",
  "#26332": "train",
  "#27676": "train",
  "#28009": "train",
  "#26953": "train",
  "#26519": "train",
  "#28407": "train",
  "#26352": "train",
  "#25497": "train",
  "#26236": "train",
  "#26866": "train",
  "#28865": "train",
  "#28812": "train",
  "#25709": "train",
  "#26884": "train",
  "#25333": "train",
  "#26233": "train",
  "#26534": "train",
  "#28601": "train",
  "#29335": "train",
  "#27003": "train",
  "#26514": "train",
  "#28935": "train",
  "#27345": "train",
  "#26527": "train",
  "#28058": "train",
  "#26506": "train",
  "#28801": "train",
  "#26132": "train",
  "#27229": "train",
  "#26542": "train",
  "#28813": "train",
  "#29380": "train",
  "#26985": "train",
  "#26290": "train",
  "#26073": "train",
  "#26535": "train",
  "#29439": "train",
  "#26944": "train",
  "#25601": "train",
  "#25586": "train",
  "#29216": "train",
  "#27616": "train",
  "#27066": "train",
  "#25930": "train",
  "#27943": "train",
  "#27006": "train",
  "#28016": "train",
  "#26454": "train",
  "#29252": "train",
  "#27228": "train",
  "#26059": "train",
  "#28167": "train",
  "#28344": "train",
  "#28038": "train",
  "#29215": "train",
  "#29171": "train",
  "#26287": "train",
  "#28819": "train",
  "#26162": "train",
  "#26337": "train",
  "#29347": "train",
  "#25325": "train",
  "#28882": "train",
  "#28847": "train",
  "#26706": "train",
  "#28468": "train",
  "#26125": "train",
  "#29448": "train",
  "#29450": "train",
  "#29540": "train",
  "#28880": "train",
  "#27772": "train",
  "#26603": "train",
  "#29120": "train",
  "#26261": "train",
  "#27102": "train",
  "#25716": "train",
  "#26067": "train",
  "#28934": "train",
  "#26865": "train",
  "#28131": "train",
  "#26092": "train",
  "#28790": "train",
  "#26656": "train",
  "#28104": "train",
  "#28304": "train",
  "#26452": "train",
  "#25894": "train",
  "#26507": "train",
  "#25567": "train",
  "#28712": "train",
  "#26475": "train",
  "#28530": "train",
  "#28391": "train",
  "#26289": "train",
  "#28299": "train",
  "#26443": "train",
  "#28700": "train",
  "#28411": "train",
  "#26599": "train",
  "#28517": "train",
  "#25639": "train",
  "#28221": "train",
  "#25702": "train",
  "#28352": "train",
  "#25392": "train",
  "#26879": "train",
  "#25395": "train",
  "#26577": "train",
  "#25327": "train",
  "#27057": "train",
  "#26457": "train",
  "#27112": "train",
  "#27069": "train",
  "#26018": "train",
  "#27267": "train",
  "#29558": "train",
  "#26014": "train",
  "#26249": "train",
  "#27637": "train",
  "#26229": "train",
  "#26885": "train",
  "#26292": "train",
  "#26230": "train",
  "#28531": "train",
  "#29549": "train",
  "#26053": "train",
  "#26339": "train",
  "#25453": "train",
  "#28730": "train",
  "#26571": "train",
  "#28113": "train",
  "#29446": "train",
  "#25502": "train",
  "#26148": "train",
  "#26929": "train",
  "#26950": "train",
  "#25637": "train",
  "#25480": "train",
  "#27389": "train",
  "#27467": "train",
  "#29568": "train",
  "#28432": "train",
  "#26655": "train",
  "#25720": "train",
  "#26312": "train",
  "#26888": "train",
  "#26770": "train",
  "#26609": "train",
  "#27045": "train",
  "#26991": "train",
  "#29214": "train",
  "#28940": "train",
  "#29499": "train",
  "#27966": "train",
  "#26646": "train",
  "#28689": "train",
  "#25822": "train",
  "#25324": "train",
  "#28216": "train",
  "#27073": "train",
  "#27039": "train",
  "#27346": "train",
  "#25802": "train",
  "#26999": "train",
  "#27391": "train",
  "#27253": "train",
  "#26668": "train",
  "#26284": "train",
  "#29437": "train",
  "#26338": "train",
  "#25537": "train",
  "#28431": "train",
  "#26605": "train",
  "#27377": "train",
  "#27250": "train",
  "#27971": "train",
  "#27234": "train",
  "#25342": "train",
  "#29377": "train",
  "#27015": "train",
  "#28303": "train",
  "#26270": "train",
  "#25382": "train",
  "#25498": "train",
  "#29185": "train",
  "#26941": "train",
  "#27232": "train",
  "#26937": "train",
  "#28163": "train",
  "#26717": "train",
  "#27357": "val",
  "#26078": "val",
  "#26882": "val",
  "#28793": "val",
  "#29081": "val",
  "#26893": "val",
  "#25890": "val",
  "#29170": "val",
  "#27353": "val",
  "#26705": "val",
  "#27496": "val",
  "#28716": "val",
  "#25563": "val",
  "#27216": "val",
  "#28409": "val",
  "#26948": "val",
  "#29463": "val",
  "#26446": "val",
  "#27247": "val",
  "#26342": "val",
  "#26922": "val",
  "#26568": "val",
  "#28169": "val",
  "#28116": "val",
  "#28688": "val",
  "#26379": "val",
  "#26895": "val",
  "#26141": "val",
  "#26921": "val",
  "#27956": "val",
  "#25413": "val",
  "#28132": "val",
  "#26480": "val",
  "#28690": "val",
  "#29115": "val",
  "#26455": "val",
  "#26669": "val",
  "#27110": "val",
  "#26069": "val",
  "#28147": "val",
  "#27004": "val",
  "#26153": "val",
  "#26349": "val",
  "#26224": "val",
  "#27743": "val",
  "#28429": "val",
  "#26691": "val",
  "#25421": "val",
  "#27059": "val",
  "#25841": "val",
  "#28470": "val",
  "#26872": "val",
  "#26068": "val",
  "#26263": "val",
  "#27077": "val",
  "#28509": "val",
  "#26340": "val",
  "#25515": "val",
  "#29557": "val",
  "#26774": "val",
  "#25513": "val",
  "#29487": "val",
  "#29520": "val",
  "#25626": "val",
  "#28053": "val",
  "#29099": "val",
  "#26560": "val",
  "#28467": "val",
  "#25340": "val",
  "#26285": "val",
  "#28343": "val",
  "#27012": "val",
  "#26333": "val",
  "#29586": "val",
  "#26191": "val",
  "#25381": "val",
  "#26532": "val",
  "#27067": "val",
  "#27249": "val",
  "#26066": "val",
  "#29468": "val",
  "#26940": "val",
  "#29117": "val",
  "#28524": "val",
  "#26143": "val",
  "#27315": "val",
  "#26453": "val",
  "#26955": "val",
  "#27009": "val",
  "#26222": "val",
  "#26924": "val",
  "#28892": "val",
  "#28369": "val",
  "#29339": "val",
  "#26220": "val",
  "#26128": "val",
  "#26052": "val",
  "#26600": "val",
  "#28862": "val",
  "#25357": "val",
  "#28792": "val",
  "#25331": "val",
  "#28223": "val",
  "#26666": "val",
  "#25758": "val",
  "#25409": "val",
  "#27062": "val",
  "#27041": "val",
  "#29506": "val",
  "#26118": "val",
  "#26463": "val",
  "#27211": "val",
  "#26947": "val",
  "#28435": "val",
  "#26528": "val",
  "#27853": "val",
  "#26698": "val",
  "#25827": "val",
  "#27698": "val",
  "#28469": "val",
  "#27007": "val",
  "#27749": "val",
  "#26949": "val",
  "#25343": "val",
  "#26462": "val",
  "#25670": "val",
  "#28015": "val",
  "#26658": "val",
  "#25873": "val",
  "#27619": "val",
  "#25816": "val",
  "#29451": "val",
  "#25888": "val",
  "#29539": "val",
  "#28385": "val",
  "#25338": "test",
  "#25339": "test",
  "#25341": "test",
  "#25389": "test",
  "#25414": "test",
  "#25427": "test",
  "#25542": "test",
  "#25604": "test",
  "#25660": "test",
  "#25662": "test",
  "#25695": "test",
  "#25708": "test",
  "#25753": "test",
  "#25801": "test",
  "#25821": "test",
  "#25858": "test",
  "#25880": "test",
  "#25900": "test",
  "#25925": "test",
  "#25945": "test",
  "#25978": "test",
  "#25980": "test",
  "#26060": "test",
  "#26079": "test",
  "#26130": "test",
  "#26147": "test",
  "#26163": "test",
  "#26194": "test",
  "#26198": "test",
  "#26202": "test",
  "#26207": "test",
  "#26208": "test",
  "#26217": "test",
  "#26218": "test",
  "#26223": "test",
  "#26234": "test",
  "#26264": "test",
  "#26266": "test",
  "#26274": "test",
  "#26275": "test",
  "#26277": "test",
  "#26288": "test",
  "#26307": "test",
  "#26310": "test",
  "#26329": "test",
  "#26330": "test",
  "#26357": "test",
  "#26431": "test",
  "#26440": "test",
  "#26441": "test",
  "#26442": "test",
  "#26445": "test",
  "#26449": "test",
  "#26479": "test",
  "#26504": "test",
  "#26548": "test",
  "#26554": "test",
  "#26565": "test",
  "#26587": "test",
  "#26594": "test",
  "#26661": "test",
  "#26665": "test",
  "#26676": "test",
  "#26714": "test",
  "#26745": "test",
  "#26761": "test",
  "#26868": "test",
  "#26874": "test",
  "#26897": "test",
  "#26934": "test",
  "#26939": "test",
  "#27016": "test",
  "#27021": "test",
  "#27071": "test",
  "#27121": "test",
  "#27145": "test",
  "#27207": "test",
  "#27212": "test",
  "#27215": "test",
  "#27227": "test",
  "#27251": "test",
  "#27252": "test",
  "#27288": "test",
  "#27401": "test",
  "#27461": "test",
  "#27570": "test",
  "#27572": "test",
  "#27645": "test",
  "#27746": "test",
  "#27765": "test",
  "#27767": "test",
  "#27770": "test",
  "#27854": "test",
  "#27939": "test",
  "#27947": "test",
  "#27948": "test",
  "#27992": "test",
  "#28063": "test",
  "#28145": "test",
  "#28233": "test",
  "#28305": "test",
  "#28306": "test",
  "#28345": "test",
  "#28398": "test",
  "#28433": "test",
  "#28434": "test",
  "#28472": "test",
  "#28481": "test",
  "#28523": "test",
  "#28529": "test",
  "#28551": "test",
  "#28565": "test",
  "#28566": "test",
  "#28588": "test",
  "#28599": "test",
  "#28607": "test",
  "#28672": "test",
  "#28694": "test",
  "#28727": "test",
  "#28729": "test",
  "#28811": "test",
  "#28814": "test",
  "#28863": "test",
  "#28864": "test",
  "#28867": "test",
  "#28868": "test",
  "#28961": "test",
  "#29116": "test",
  "#29158": "test",
  "#29169": "test",
  "#29334": "test",
  "#29341": "test",
  "#29343": "test",
  "#29378": "test",
  "#29379": "test",
  "#29401": "test",
  "#29443": "test",
  "#29462": "test",
  "#29467": "test",
  "#29502": "test",
  "#29528": "test",
  "#29542": "test",
  "#29560": "test",
  "#29580": "test",
  "#29581": "test"
 }
}
