{
 "schema": "s1flow/split@2",
 "seed": 1,
 "test_share": 0.3,
 "at": "2026-10-31T08:36:26Z",
 "source": "initial",
 "assign": {
  "val-766": "train",
  "val-27": "train",
  "val-255": "train",
  "val-25": "train",
  "val-989": "train",
  "val-646": "train",
  "val-82": "train",
  "val-192": "train",
  "val-455": "train",
  "val-991": "train",
  "val-640": "train",
  "val-554": "train",
  "val-967": "train",
  "val-606": "train",
  "val-826": "train",
  "val-614": "train",
  "val-224": "train",
  "val-52": "train",
  "val-508": "train",
  "val-880": "train",
  "val-1011": "train",
  "val-422": "train",
  "val-611": "train",
  "val-677": "train",
  "val-522": "train",
  "val-494": "train",
  "val-125": "train",
  "val-713": "train",
  "val-36": "train",
  "val-797": "train",
  "val-127": "train",
  "val-841": "train",
  "val-282": "train",
  "val-793": "train",
  "val-188": "train",
  "val-13": "train",
  "val-467": "train",
  "val-998": "train",
  "val-189": "train",
  "val-702": "train",
  "val-341": "train",
  "val-391": "train",
  "val-686": "train",
  "val-746": "train",
  "val-480": "train",
  "val-292": "train",
  "val-388": "train",
  "val-931": "train",
  "val-538": "train",
  "val-229": "train",
  "val-398": "train",
  "val-340": "train",
  "val-87": "train",
  "val-788": "train",
  "val-386": "train",
  "val-791": "train",
  "val-104": "train",
  "val-487": "train",
  "val-128": "train",
  "val-437": "train",
  "val-779": "train",
  "val-701": "train",
  "val-968": "train",
  "val-277": "train",
  "val-631": "train",
  "val-579": "train",
  "val-821": "train",
  "val-17": "train",
  "val-272": "train",
  "val-483": "train",
  "val-510": "train",
  "val-1030": "train",
  "val-507": "train",
  "val-358": "train",
  "val-783": "train",
  "val-735": "train",
  "val-414": "train",
  "val-198": "train",
  "val-970": "train",
  "val-408": "train",
  "val-517": "train",
  "val-983": "train",
  "val-935": "train",
  "val-333": "train",
  "val-48": "train",
  "val-485": "train",
  "val-107": "train",
  "val-823": "train",
  "val-260": "train",
  "val-925": "train",
  "val-56": "train",
  "val-459": "train",
  "val-810": "train",
  "val-130": "train",
  "val-209": "train",
  "val-698": "train",
  "val-539": "train",
  "val-401": "train",
  "val-334": "train",
  "val-590": "train",
  "val-876": "train",
  "val-89": "train",
  "val-270": "train",
  "val-605": "train",
  "val-942": "train",
  "val-323": "train",
  "val-749": "train",
  "val-636": "train",
  "val-891": "train",
  "val-819": "train",
  "val-745": "train",
  "val-663": "train",
  "val-957": "train",
  "val-940": "train",
  "val-65": "train",
  "val-349": "train",
  "val-317": "train",
  "val-530": "train",
  "val-729": "train",
  "val-466": "train",
  "val-759": "train",
  "val-62": "train",
  "val-174": "train",
  "val-717": "train",
  "val-549": "train",
  "val-730": "val",
  "val-328": "val",
  "val-643": "val",
  "val-861": "val",
  "val-1": "val",
  "val-430": "val",
  "val-136": "val",
  "val-372": "val",
  "val-632": "val",
  "val-684": "val",
  "val-654": "val",
  "val-700": "val",
  "val-139": "val",
  "val-439": "val",
  "val-70": "val",
  "val-862": "val",
  "val-190": "val",
  "val-825": "val",
  "val-111": "val",
  "val-219": "val",
  "val-682": "val",
  "val-489": "val",
  "val-474": "val",
  "val-230": "val",
  "val-169": "val",
  "val-615": "val",
  "val-14": "val",
  "val-425": "val",
  "val-688": "val",
  "val-919": "val",
  "val-987": "val",
  "val-481": "val",
  "val-302": "val",
  "val-820": "val",
  "val-492": "val",
  "val-502": "val",
  "val-638": "val",
  "val-563": "val",
  "val-287": "val",
  "val-824": "val",
  "val-705": "val",
  "val-24": "val",
  "val-732": "val",
  "val-577": "val",
  "val-597": "val",
  "val-774": "val",
  "val-298": "val",
  "val-241": "val",
  "val-754": "val",
  "val-695": "val",
  "val-160": "val",
  "val-462": "val",
  "val-992": "val",
  "val-458": "val",
  "val-33": "val",
  "val-345": "val",
  "val-399": "val",
  "val-519": "val",
  "val-777": "val",
  "val-674": "val",
  "val-807": "val",
  "val-354": "val",
  "val-831": "val",
  "val-860": "val",
  "val-535": "val",
  "val-743": "val",
  "val-68": "val",
  "val-696": "val",
  "val-888": "val",
  "val-763": "val",
  "val-546": "val",
  "val-374": "val",
  "val-1000": "val",
  "val-621": "val",
  "val-568": "val",
  "val-896": "val",
  "val-890": "val",
  "val-564": "val",
  "val-897": "val",
  "val-393": "val",
  "val-239": "val",
  "val-584": "val",
  "val-644": "val",
  "val-432": "val",
  "val-953": "val",
  "val-100": "test",
  "val-1009": "test",
  "val-1022": "test",
  "val-1024": "test",
  "val-108": "test",
  "val-109": "test",
  "val-124": "test",
  "val-133": "test",
  "val-137": "test",
  "val-150": "test",
  "val-154": "test",
  "val-156": "test",
  "val-161": "test",
  "val-176": "test",
  "val-178": "test",
  "val-183": "test",
  "val-196": "test",
  "val-20": "test",
  "val-235": "test",
  "val-238": "test",
  "val-250": "test",
  "val-271": "test",
  "val-279": "test",
  "val-295": "test",
  "val-3": "test",
  "val-300": "test",
  "val-306": "test",
  "val-307": "test",
  "val-314": "test",
  "val-344": "test",
  "val-352": "test",
  "val-368": "test",
  "val-37": "test",
  "val-370": "test",
  "val-380": "test",
  "val-384": "test",
  "val-389": "test",
  "val-4": "test",
  "val-400": "test",
  "val-407": "test",
  "val-413": "test",
  "val-415": "test",
  "val-427": "test",
  "val-433": "test",
  "val-447": "test",
  "val-469": "test",
  "val-476": "test",
  "val-477": "test",
  "val-482": "test",
  "val-49": "test",
  "val-5": "test",
  "val-525": "test",
  "val-534": "test",
  "val-543": "test",
  "val-550": "test",
  "val-558": "test",
  "val-574": "test",
  "val-578": "test",
  "val-604": "test",
  "val-651": "test",
  "val-662": "test",
  "val-669": "test",
  "val-683": "test",
  "val-69": "test",
  "val-716": "test",
  "val-718": "test",
  "val-719": "test",
  "val-726": "test",
  "val-74": "test",
  "val-747": "test",
  "val-750": "test",
  "val-751": "test",
  "val-760": "test",
  "val-761": "test",
  "val-769": "test",
  "val-77": "test",
  "val-772": "test",
  "val-778": "test",
  "val-780": "test",
  "val-80": "test",
  "val-812": "test",
  "val-865": "test",
  "val-886": "test",
  "val-904": "test",
  "val-905": "test",
  "val-929": "test",
  "val-94": "test",
  "val-946": "test",
  "val-962": "test",
  "val-99": "test"
 }
}
