{
 "schema": "s1flow/split@2",
 "seed": 1,
 "test_share": 0.3,
 "at": "2026-10-31T05:07:48Z",
 "source": "initial",
 "assign": {
  "t01695": "train",
  "t01740": "train",
  "t01370": "train",
  "t01732": "train",
  "t01783": "train",
  "t01322": "train",
  "t01513": "train",
  "t01271": "train",
  "t01769": "train",
  "t01853": "train",
  "t01626": "train",
  "t01543": "train",
  "t01827": "train",
  "t01459": "train",
  "t01562": "train",
  "t01847": "train",
  "t01333": "train",
  "t01432": "train",
  "t01859": "train",
  "t01538": "train",
  "t01519": "train",
  "t01313": "train",
  "t01466": "train",
  "t01327": "train",
  "t01823": "train",
  "t01225": "train",
  "t01400": "train",
  "t01727": "train",
  "t01738": "train",
  "t01657": "train",
  "t01588": "train",
  "t00047": "train",
  "t01384": "train",
  "t01828": "train",
  "t01824": "train",
  "t01526": "train",
  "t01347": "train",
  "t01428": "train",
  "t01573": "train",
  "t01789": "train",
  "t01697": "train",
  "t01768": "train",
  "t01193": "train",
  "t01599": "train",
  "t01296": "train",
  "t01461": "train",
  "t01687": "train",
  "t01420": "train",
  "t01397": "train",
  "t01713": "train",
  "t01624": "train",
  "t00915": "train",
  "t01392": "train",
  "t01598": "train",
  "t01235": "train",
  "t01788": "train",
  "t01694": "train",
  "t01662": "train",
  "t01212": "train",
  "t01814": "train",
  "t01765": "train",
  "t01516": "train",
  "t01725": "train",
  "t00353": "train",
  "t00784": "train",
  "t00577": "train",
  "t00800": "train",
  "t00277": "train",
  "t00995": "train",
  "t00242": "train",
  "t00143": "train",
  "t00356": "train",
  "t00976": "train",
  "t00056": "train",
  "t00529": "train",
  "t00585": "train",
  "t00387": "train",
  "t00506": "train",
  "t00215": "train",
  "t00592": "train",
  "t00715": "train",
  "t00164": "train",
  "t00257": "train",
  "t00852": "train",
  "t01004": "train",
  "t00944": "train",
  "t00594": "train",
  "t00835": "train",
  "t00205": "train",
  "t00834": "train",
  "t00857": "train",
  "t00444": "train",
  "t00186": "train",
  "t00971": "train",
  "t00348": "train",
  "t00121": "train",
  "t00870": "train",
  "t00503": "train",
  "t00422": "train",
  "t00740": "train",
  "t00128": "train",
  "t00102": "train",
  "t00204": "train",
  "t00185": "train",
  "t00017": "train",
  "t00553": "train",
  "t00996": "train",
  "t00271": "train",
  "t00075": "train",
  "t00931": "train",
  "t00762": "train",
  "t00868": "train",
  "t01028": "train",
  "t00695": "train",
  "t00419": "train",
  "t00534": "train",
  "t00395": "train",
  "t00262": "train",
  "t00827": "train",
  "t00403": "train",
  "t00841": "train",
  "t00437": "train",
  "t00758": "train",
  "t01611": "train",
  "t00684": "train",
  "t00897": "train",
  "t01818": "val",
  "t00855": "val",
  "t01844": "val",
  "t01520": "val",
  "t01284": "val",
  "t01282": "val",
  "t01215": "val",
  "t01485": "val",
  "t01443": "val",
  "t01723": "val",
  "t01592": "val",
  "t01239": "val",
  "t01316": "val",
  "t01677": "val",
  "t01861": "val",
  "t01387": "val",
  "t01684": "val",
  "t01850": "val",
  "t01705": "val",
  "t00382": "val",
  "t01252": "val",
  "t01257": "val",
  "t01317": "val",
  "t00953": "val",
  "t01671": "val",
  "t01763": "val",
  "t01272": "val",
  "t01361": "val",
  "t01375": "val",
  "t01299": "val",
  "t01747": "val",
  "t01822": "val",
  "t01208": "val",
  "t01310": "val",
  "t01554": "val",
  "t01340": "val",
  "t01122": "val",
  "t00139": "val",
  "t01162": "val",
  "t01764": "val",
  "t01437": "val",
  "t01664": "val",
  "t00554": "val",
  "t00166": "val",
  "t00772": "val",
  "t00691": "val",
  "t00161": "val",
  "t00701": "val",
  "t00116": "val",
  "t00491": "val",
  "t00994": "val",
  "t00890": "val",
  "t00081": "val",
  "t00085": "val",
  "t01087": "val",
  "t00743": "val",
  "t00914": "val",
  "t00507": "val",
  "t01053": "val",
  "t00476": "val",
  "t00046": "val",
  "t00783": "val",
  "t00939": "val",
  "t01101": "val",
  "t00223": "val",
  "t00867": "val",
  "t00755": "val",
  "t00910": "val",
  "t00849": "val",
  "t00183": "val",
  "t00625": "val",
  "t01059": "val",
  "t00797": "val",
  "t00676": "val",
  "t00229": "val",
  "t00582": "val",
  "t00231": "val",
  "t00818": "val",
  "t01007": "val",
  "t00106": "val",
  "t00074": "val",
  "t00741": "val",
  "t01586": "val",
  "t00197": "val",
  "t00007": "test",
  "t00016": "test",
  "t00040": "test",
  "t00042": "test",
  "t00061": "test",
  "t00129": "test",
  "t00209": "test",
  "t00230": "test",
  "t00232": "test",
  "t00248": "test",
  "t00283": "test",
  "t00292": "test",
  "t00320": "test",
  "t00341": "test",
  "t00347": "test",
  "t00359": "test",
  "t00362": "test",
  "t00381": "test",
  "t00396": "test",
  "t00446": "test",
  "t00470": "test",
  "t00472": "test",
  "t00474": "test",
  "t00475": "test",
  "t00526": "test",
  "t00540": "test",
  "t00551": "test",
  "t00572": "test",
  "t00588": "test",
  "t00614": "test",
  "t00640": "test",
  "t00649": "test",
  "t00706": "test",
  "t00750": "test",
  "t00769": "test",
  "t00775": "test",
  "t00805": "test",
  "t00814": "test",
  "t00820": "test",
  "t00854": "test",
  "t00863": "test",
  "t00904": "test",
  "t00982": "test",
  "t01013": "test",
  "t01034": "test",
  "t01081": "test",
  "t01102": "test",
  "t01141": "test",
  "t01152": "test",
  "t01171": "test",
  "t01178": "test",
  "t01185": "test",
  "t01216": "test",
  "t01220": "test",
  "t01226": "test",
  "t01236": "test",
  "t01240": "test",
  "t01247": "test",
  "t01266": "test",
  "t01280": "test",
  "t01281": "test",
  "t01351": "test",
  "t01396": "test",
  "t01406": "test",
  "t01409": "test",
  "t01410": "test",
  "t01418": "test",
  "t01436": "test",
  "t01480": "test",
  "t01499": "test",
  "t01533": "test",
  "t01563": "test",
  "t01578": "test",
  "t01581": "test",
  "t01619": "test",
  "t01631": "test",
  "t01658": "test",
  "t01660": "test",
  "t01670": "test",
  "t01688": "test",
  "t01701": "test",
  "t01753": "test",
  "t01755": "test",
  "t01781": "test",
  "t01811": "test",
  "t01820": "test",
  "t01840": "test",
  "t01842": "test",
  "t01855": "test",
  "t01865": "test"
 }
}
