{
 "schema": "s1flow/split@2",
 "seed": 1,
 "test_share": 0.3,
 "at": "2026-10-31T05:08:59Z",
 "source": "optimized/gepa-d1",
 "assign": {
  "nohist-urgent-room": "train",
  "sw-dont-touch-file": "train",
  "add-milk": "train",
  "nohist-koyo-question": "train",
  "thumbs-to-send-question": "train",
  "email-send-ok": "train",
  "change-to-three": "train",
  "madaa": "train",
  "ryokai-to-cancel-fee": "train",
  "sw-fix-tests-un": "train",
  "hungry-pending-restaurant": "train",
  "thanks-plus-bus": "train",
  "cancel-scheduled-draft": "train",
  "book-yes-un": "train",
  "self-correct-train-date": "train",
  "maaiika-accept-20h": "train",
  "yappari-iiya-decline-offer": "train",
  "oyasumi": "train",
  "mouiiyo-thanks-decline": "train",
  "un-to-checkin-info": "train",
  "maaiika-coupon": "train",
  "thanks-after-booking": "train",
  "ryokai-user-action": "train",
  "yoroshiku-already-agreed": "train",
  "thumbs-to-sent": "train",
  "tashikani-no-change": "train",
  "wait-before-submit": "val",
  "digits-verification-code": "val",
  "tickets-kaatte": "val",
  "sw-migration-wait": "val",
  "sw-naming-change": "val",
  "restaurant-iine-hold": "val",
  "rain-bbq-musing": "val",
  "plan-a-sorede": "val",
  "ok-ambiguous-choice": "val",
  "hotel-jaa-yasui": "val",
  "digits-nohist": "val",
  "haai-while-working": "val",
  "atode-yomu": "val",
  "tasukaru": "val",
  "sw-deploy-thanks": "val",
  "ok-info": "val",
  "a-only": "test",
  "allergy-mid-booking": "test",
  "birthday-self-correct": "test",
  "budget-to-30k": "test",
  "busy-later": "test",
  "complaint-wrong-count": "test",
  "flight-cancelled": "test",
  "garbage-jkl": "test",
  "iine-info": "test",
  "mouiiyo-angry-while-working": "test",
  "moving-delivery": "test",
  "question-mark-only": "test",
  "reminder-onegai": "test",
  "ryokai-finished-report": "test",
  "samu": "test",
  "stop-unsubscribe": "test",
  "sw-lint-ok": "test",
  "sw-yattoka": "test",
  "takai-to-booking-question": "test",
  "tashikani-change-sunday": "test",
  "wrong-file": "test",
  "www": "test",
  "yappari-iiya-in-progress": "test"
 }
}
