{
 "schema": "s1flow/split@2",
 "seed": 1,
 "test_share": 0.3,
 "at": "2026-10-31T05:15:37Z",
 "source": "optimized/gepa-d1",
 "assign": {
  "m50": "train",
  "m944": "train",
  "m15987": "train",
  "m16781": "train",
  "m3029": "train",
  "m2056": "train",
  "m11353": "train",
  "m11474": "train",
  "m12689": "train",
  "m3835": "train",
  "m5966": "train",
  "m15472": "train",
  "m15565": "train",
  "m15216": "train",
  "m9720": "train",
  "m9700": "train",
  "m9827": "train",
  "m4618": "train",
  "m426": "train",
  "m16402": "train",
  "m16297": "train",
  "m16317": "train",
  "m16353": "train",
  "m16002": "train",
  "m13372": "train",
  "m14481": "train",
  "m13242": "train",
  "m3834": "train",
  "m2016": "train",
  "m3543": "train",
  "m2551": "train",
  "m10571": "train",
  "m10931": "train",
  "m14889": "train",
  "m13984": "train",
  "m10285": "train",
  "m10263": "train",
  "m10755": "train",
  "m10494": "train",
  "m13684": "train",
  "m13740": "train",
  "m6973": "train",
  "m8366": "train",
  "m5758": "train",
  "m4132": "train",
  "m9554": "train",
  "m9216": "train",
  "m4813": "train",
  "m486": "train",
  "m15511": "train",
  "m15333": "train",
  "m13192": "train",
  "m13552": "train",
  "m13172": "train",
  "m5912": "train",
  "m11812": "train",
  "m6376": "train",
  "m10772": "train",
  "m7892": "train",
  "m2134": "train",
  "m5082": "train",
  "m11770": "train",
  "m11845": "train",
  "m10053": "train",
  "m10171": "train",
  "m168": "train",
  "m3671": "train",
  "m12383": "train",
  "m12710": "train",
  "m3486": "train",
  "m6055": "train",
  "m2578": "train",
  "m730": "train",
  "m2174": "train",
  "m2387": "train",
  "m1640": "train",
  "m4090": "train",
  "m5652": "train",
  "m2566": "train",
  "m13754": "train",
  "m14544": "train",
  "m2903": "train",
  "m5697": "train",
  "m4241": "train",
  "m4854": "train",
  "m3581": "train",
  "m5593": "train",
  "m5813": "train",
  "m122": "train",
  "m14440": "train",
  "m14317": "train",
  "m12672": "train",
  "m12182": "train",
  "m1084": "train",
  "m2201": "train",
  "m5974": "train",
  "m4130": "train",
  "m5103": "train",
  "m201": "train",
  "m2733": "train",
  "m448": "train",
  "m5579": "train",
  "m4155": "train",
  "m12797": "train",
  "m11140": "train",
  "m14792": "train",
  "m7817": "train",
  "m16975": "train",
  "m17111": "train",
  "m3008": "train",
  "m1072": "train",
  "m3204": "train",
  "m14": "train",
  "m5523": "val",
  "m5497": "val",
  "m16693": "val",
  "m1076": "val",
  "m3103": "val",
  "m11349": "val",
  "m11442": "val",
  "m12233": "val",
  "m2255": "val",
  "m15166": "val",
  "m15454": "val",
  "m9718": "val",
  "m11273": "val",
  "m389": "val",
  "m16045": "val",
  "m17123": "val",
  "m16627": "val",
  "m16178": "val",
  "m8322": "val",
  "m475": "val",
  "m1030": "val",
  "m158": "val",
  "m2351": "val",
  "m2975": "val",
  "m10927": "val",
  "m10760": "val",
  "m14429": "val",
  "m12982": "val",
  "m10357": "val",
  "m10433": "val",
  "m10808": "val",
  "m15109": "val",
  "m8978": "val",
  "m5321": "val",
  "m6093": "val",
  "m9237": "val",
  "m9562": "val",
  "m1252": "val",
  "m974": "val",
  "m15203": "val",
  "m15199": "val",
  "m13199": "val",
  "m13766": "val",
  "m5911": "val",
  "m11920": "val",
  "m7289": "val",
  "m8431": "val",
  "m5292": "val",
  "m11904": "val",
  "m14648": "val",
  "m1247": "val",
  "m5324": "val",
  "m12121": "val",
  "m12844": "val",
  "m3474": "val",
  "m4171": "val",
  "m1377": "val",
  "m2030": "val",
  "m1630": "val",
  "m4702": "val",
  "m2690": "val",
  "m4966": "val",
  "m14473": "val",
  "m31": "val",
  "m2959": "val",
  "m6166": "val",
  "m6064": "val",
  "m3205": "val",
  "m494": "val",
  "m13853": "val",
  "m14917": "val",
  "m12413": "val",
  "m4119": "val",
  "m3771": "val",
  "m1452": "val",
  "m3196": "val",
  "m5149": "val",
  "m5812": "val",
  "m4166": "val",
  "m12264": "val",
  "m11026": "val",
  "m11778": "val",
  "m7219": "val",
  "m15946": "val",
  "m16983": "val",
  "m2403": "val",
  "m5574": "val",
  "m3522": "val",
  "m10093": "test",
  "m10216": "test",
  "m10349": "test",
  "m10381": "test",
  "m1042": "test",
  "m10462": "test",
  "m10600": "test",
  "m1065": "test",
  "m10757": "test",
  "m10815": "test",
  "m10982": "test",
  "m11266": "test",
  "m11582": "test",
  "m11644": "test",
  "m11706": "test",
  "m11744": "test",
  "m1176": "test",
  "m11871": "test",
  "m12020": "test",
  "m12436": "test",
  "m12446": "test",
  "m12453": "test",
  "m12606": "test",
  "m12693": "test",
  "m12724": "test",
  "m12779": "test",
  "m12789": "test",
  "m12800": "test",
  "m13819": "test",
  "m13908": "test",
  "m14044": "test",
  "m14342": "test",
  "m14526": "test",
  "m14605": "test",
  "m15181": "test",
  "m1551": "test",
  "m16225": "test",
  "m16470": "test",
  "m1658": "test",
  "m16872": "test",
  "m16907": "test",
  "m1710": "test",
  "m1960": "test",
  "m2165": "test",
  "m2480": "test",
  "m2724": "test",
  "m286": "test",
  "m2985": "test",
  "m3030": "test",
  "m322": "test",
  "m3330": "test",
  "m3364": "test",
  "m399": "test",
  "m4013": "test",
  "m4268": "test",
  "m4271": "test",
  "m4547": "test",
  "m46": "test",
  "m468": "test",
  "m4887": "test",
  "m4913": "test",
  "m4985": "test",
  "m5037": "test",
  "m5050": "test",
  "m5051": "test",
  "m508": "test",
  "m5152": "test",
  "m5219": "test",
  "m5318": "test",
  "m5332": "test",
  "m5611": "test",
  "m5691": "test",
  "m5823": "test",
  "m5919": "test",
  "m6014": "test",
  "m608": "test",
  "m6118": "test",
  "m6366": "test",
  "m6959": "test",
  "m7046": "test",
  "m7232": "test",
  "m7693": "test",
  "m80": "test",
  "m8795": "test",
  "m884": "test",
  "m9194": "test",
  "m9327": "test"
 }
}
